63,"Seal Beach RV Park",33.7499,-118.0846,"https://www.militarycampgrounds.us/california/seabreeze-at-seal-beach","https://www.militarycampgrounds.us/media/reviews/photos/thumbnail/640x460s/32/29/b8/Seabreeze%20CA%20008.jpg","[]","default",1,"{""title"":""California"",""url"":""california""}","no_access","{""user"":{""rating"":4.5157,""count"":118,""ratingClass"":""jrRatingsStyle1 jrRatingsGreen""}}","Seal Beach Naval Weapons Station, Seal Beach, CA","33.7499, -118.0846","","From I-405 take the Seal Beach Blvd off-ramp. Turn South on Seal Beach Blvd and travel south about 1.5 miles. Turn left at Westminster Blvd, get in the far right lane and go 100 yards to the Westminster Gate at light; turn right.  After gate, follow Kitts Hwy to Forestall Av and turn right; then turn right past the Seabreeze RV Resort marque.  ----  Although the RV Park tells us to use the above directions, MANY TIMES the Westminster Gate will be closed, or they won't allow the public through these gates (when ammunition is being delivered). As an alternative, directions for the main gate are: From I-405 take the Seal Beach Blvd off-ramp. Turn left on Seal Beach Blvd and travel south about 2 miles. The main gate (GATE 1) will be on your left on Forrestal Ave.. After entering the gate, the campground is a block down on your left.","","Reservations: (877) 628-9233 - Office: (562) 626-7504","(562) 626-7893","Seabreeze Campground, Bldg 35, Code N92, 800 Seal Beach Blvd, Seal Beach, CA 90740","http://mwrtoday.com/sealbeach/recreation/recreationallodging/","Active Duty, National Guard, Reservists, Retired Military, 0-100% DAV, Purple Heart Recipients, Former POW, Veteran Caregivers, DoD civilians. Read this article on Authorized Users","Year round. Peak Season: May through Labor Day Weekend","Reservations are recommended. Active Duty: ?? months in advance. Reservists, retired military, 100% disabled veterans, DoD civilians and retired DoD civilians: 6 months in advance.","Free WiFi available.","USPS: (Your name), c/o General Delivery, 2929 Westminster Ave., Seal Beach, CA 90740-9999  ----   UPS/FedEx: UPS/FedEx: (Your Name), 800 Seal Beach Blvd, Bldg. 35, (Your Space #), Seal Beach, CA 90740","Pets are allowed at the RV Resort; however, they are not allowed in the cabana area, restrooms, laundry or registration buildings.  There is a limit of domestic 3 pets. The owner of the pet is responsible for cleaning up after their pet.","","Tennis, Sand Volleyball Court, Cabana and BBQ, ITT Ticket Office, Club, Credit Union. RV storage available at $2 per foot/mo. ","Dump, SewerWaterElectricLaundryShowersPlaygroundGolfFitness CenterShoppeteHospital, ClinicCar Wash","","Rates are for military-DoD. Rates are for 4 people (Military) or 2 people (DoD/Guests). Extra people are another $1.50 per night. 30 day stay limit and must be out for at least 14 days before returning. 180 day total stay limit per year. Monthly rates are only valid November 1st - March 31st.",,,,,,"http://get.dodlodging.net/propertys/Seabreeze-RV-Park",
62,"Camp San Luis Obispo RV Park",35.323273,-120.736769,"https://www.militarycampgrounds.us/california/camp-san-luis-obispo-rv-park","https://www.militarycampgrounds.us/media/reviews/photos/thumbnail/640x460s/17/1c/e0/DSC_0105.jpg","[]","default",1,"{""title"":""California"",""url"":""california""}","no_access","{""user"":{""rating"":4.0719,""count"":80,""ratingClass"":""jrRatingsStyle1 jrRatingsGreen""}}","Camp San Luis Obispo, San Luis Obispo, CA","35.323273, -120.736769","","From US-101 in San Luis Obispo take SR-1 Northwest toward Morro Bay, going approx. 5 miles to Front Gate of Camp San Luis Obispo (on the left hand side of the road). Turn left and enter the front gate of Camp San Luis Obispo using the right lane. They'll open the gate for you. Upon enter the installation, make an immediate left hand turn onto San Joaquin Ave. Look for the Billeting sign on the right (Bldg 738). There's room for big rigs to park in front of Billeting. After checking in, make an immediate right (SW) onto Ventura Ave. Continue straight until you cross a bridge over the creek. Then make an immediate right turn (NW) onto Colusa Ave. Continue on Colusa Ave. until you come to a closed gate. The campground is on your left. ","","(805) 594-6500","(805) 594-6524","Billeting Office, Camp San Louis Obispo, 10 Sonoma Avenue Bldg 738, San Luis Obispo, 93405","http://www.calguard.ca.gov/CSLO/Pages/Billeting.aspx","Active Duty, National Guard, Reservists, Retired Military, 0-100% DAV, Purple Heart Recipients, Former POW, Veteran Caregivers, DoD civilians, Sponsored Guests. Read this article on Authorized Users","Year round.","Accepted 30 days in advance. A credit card is required for a reservation, but you can pay by check or cash at check-in. If reservations are not canceled 72 hours in advance, there is a 1 night charge. There is a 30 day stay limit per calendar year.","No Internet access at the campground. There is a dial-up connection at the Billeting office.","Not accepted at the campground or Billeting.","Allowed with usual leash and clean-up rules. Limit of two per RV.","",,"Dump, SewerWaterElectricTent AreaShowersPlaygroundExchangeFitness CenterMuseum","","There are books and VHS available for checkout from the Billeting office. Low price is for official duty, higher price is when not on official duty. The Billeting (check-in) office hours: Daily 0800-1630.  Closed on federal holidays. The are enforcing the 1 PM check-in time.",,,"35.325487 120.727302",,"Retired is allowed to use dining facilities.",,
60,"Point Mugu Recreation Facilities",34.09983,-119.10425,"https://www.militarycampgrounds.us/california/point-mugu-recreation-facilities","https://www.militarycampgrounds.us/media/reviews/photos/thumbnail/640x460s/bb/4a/73/PtMugu003.jpg","[]","default",1,"{""title"":""California"",""url"":""california""}","no_access","{""user"":{""rating"":3.8982,""count"":83,""ratingClass"":""jrRatingsStyle1 jrRatingsGreen""}}","Point Mugu Naval Air Station/Ventura County Naval Base, CA","34.09983, -119.10425","","From US-101, take the Las Posas Rd exit heading South. -- From SR-1, turn South onto Las Posas Rd. This road will take you to the gate. Once through the gate, continue on Las Posas Rd to the first stop sign. Las Posas goes around a curve to the right and becomes 13th St.  The stop sign is on 13th St.  Turn left onto Laguna Rd. Go about .7 miles to the Beach Motel on your left. Turn left on 16th Street. The Outdoor Recreation building on the left is the new check-in spot for the park.","","(805) 989-8407","(805) 989-5413","Bldg 774 MWR Dept Code 836300E 311 Main St. Suite 1, Point Mugu, CA 93042-5001","http://navylifesw.com/ventura/recreation/parkspicnicareas/","Active Duty, National Guard, Reservists, Retired Military, 0-100% DAV, Purple Heart Recipients, Former POW, Veteran Caregivers, DoD civilians, Sponsored Guests. Read this article on Authorized Users","Year round.","Accepted. Active duty can make a reservation up to 1 year in advance. Retired, DOD, and all others can make reservations 6 months in advance. ","Free Wi-fi in the RV Park and DSL inside the hotel rooms (bring your own Ethernet cable) with 2 desks for computers in the Beach Hotel lobby.","USPS: (Your name), c/o General Delivery, 560 East Pleasant Valley Road, Port Hueneme, CA  93041","No pets in motel. 2 pets allowed in the campground with usual leash and clean-up rules.","","Propane at gas station.","Dump, SewerWaterElectricTent AreaLaundryShowersPlaygroundPicinic AreaBeachBoating, Boat RentalsGasExchangeFitness CenterShoppeteSnack BarClass VIMovie Theater","","30 day stay limit in campground, with 7 days out. 7 day stay limit in hotel. No annual limit. Tent sites are closed Feb 15-May 30th for Seal Pup Birthing Season. Motel rates vary on type of accommodation. Higher rates (motel and campground) are for civilians. Check-in and Check-out is noon.",,,"34.114616, -119.089374",,,"http://get.dodlodging.net/propertys/Point-Mugu-Beach-Motel--RV-Park",
59,"Petaluma Lake Area Campsites",38.24724,-122.78319,"https://www.militarycampgrounds.us/california/petaluma-lake-area-campsites","https://www.militarycampgrounds.us/media/reviews/photos/thumbnail/640x460s/c8/56/e6/DSC_0117.jpg","[]","default",1,"{""title"":""California"",""url"":""california""}","no_access","{""user"":{""rating"":4.4306,""count"":36,""ratingClass"":""jrRatingsStyle1 jrRatingsGreen""}}","Petaluma Coast Guard Training Center, Petaluma, CA","38.24724, -122.78319","","Take Washington Street exit off US 101, proceed west through the City of Petaluma. After passing the Chamber of Commerce building on the right, continue 8 miles (Washington Street will become Bodega Avenue). Follow the Coast Guard signs and turn left onto Tomales Road. A flashing amber light marks the main gate. Turn left through the main gate and immediately turn right and go around the building. Stop at the gate. When directed to leave the gate area, turn right and go straight on Pennsylvania Avenue. Park at the helo pad on the left past the gym since there is no big rig parking permitted in the gym area. Campground check-in is at Building No. 250, called ""The Hub"". You can go to the campground and get a site, then return for check-in. Proceed down the hill on Colorado Avenue until you get to Missouri Ave where the large propane tank is. Turn left, then stay right onto Wisconsin Ave. Take Wisconson Ave. until it hits Pennsylvania again and then turn left. The campground will be on the left just after the playground.","","(707) 765-7341/7580",,"Commanding Officer, Attn: MWR, 599 Tomales Road, Coast Guard Training Center, Petaluma, CA 94952-5000",,"Active Duty, National Guard, Reservists, Retired Military, 0-100% DAV, Purple Heart Recipients, Former POW, Veteran Caregivers, DoD civilians, Sponsored Guests. Read this article on Authorized Users","Year round.","Accepted no earlier than 90 days in advance. Reservations can be made 8AM-10PM (PST), 7 days a week.","Free WiFi available at the campground and available at the library during the day (closed Sundays and holidays) and after 1700 at the club.","General Delivery, c/o (Your Name), RV Park, 599 Tomales RD, Petaluma, CA 94952-9999","Declare your pet. Usual leash and clean-up rules.","","Softball, Volleyball, Horseshoes, Archery, Dining Hall (all can eat).","Dump, SewerWaterElectricPlaygroundPicinic AreaFishingGasFitness CenterShoppeteSwimmingSnack BarMovie Theater","","Guests pay double price. Dump is located 1/2 mile away from the park. From RV Park, turn Right onto Wisconsin Ave. Got to end , then turn right onto Colorado Ave. Dump is near corner on right. Maximum 2 week stay, then out 1 day. Campground check-in is at the MWR library.",,,"38.257249, -122.800255",,"Retired are allowed to dine.",,
57,"March ARB FamCamp",33.8934,-117.25,"https://www.militarycampgrounds.us/california/march-arb-famcamp","https://www.militarycampgrounds.us/media/reviews/photos/thumbnail/640x460s/eb/e1/57/March_CA.jpg","[]","default",1,"{""title"":""California"",""url"":""california""}","no_access","{""user"":{""rating"":3.4696,""count"":46,""ratingClass"":""jrRatingsStyle1 jrRatingsGreen""}}","March Air Reserve Base, Riverside, CA","33.8934, -117.25","","Take the ""Cactus Avenue - Moreno Valley"" exit East off I-215. Head east to Main Gate entrance on right. Although the main gate (Meyer Gate) looks intimidating for large rigs to maneuver, it's not. There is plenty of room to get around the barriers.  Once through the main gate, continue down Graeber Street for 1.5 miles. Turn left BEFORE the ATC tower on the road known as Riverside Drive, then a quick right onto ""Y"" Street. FamCamp is in front of you. Check-in is at the FamCamp office (Bldg. 610), located in the laundry room. For evenings and weekends, there is a self check-in box. More details on self check-in are available at Bldg. 610.","","(951) 655-3983 (Mon-Fri 0830â€“1200 & 1400-1600)",,"Outdoor Recreation, 1870 Graeber Street, Bldg 434, Moreno Valley, CA 92518-5000","http://www.march.afrc.af.mil/","Active Duty, National Guard, Reservists, Retired Military, 0-100% DAV, Purple Heart Recipients, Former POW, Veteran Caregivers, DoD civilians. Read this article on Authorized Users","Year round.","Not accepted.","Free WiFi available at the FamCamp.","(Your Name), c/o General Delivery, Moreno Valley, CA 92553-9997","Pets are allowed, with usual leash and clean-up rules. 2 pet limit.","","RV Storage.","Dump, SewerWaterElectricLaundryShowersCommissaryExchangeShoppeteSnack Bar","","14 day stay-limit, which can be extended (if no one on the waiting list) up to 6 months maximum. Dry camping pn the grass next to Bldg 610. Use the Main Gate to access the Commissary and BX, which is just outside the Riverside gate(only open on UTA weekends). Consolidated club and pizzeria hours are limited. Coffee and notions shops in lodging building 100. Base is convenient to downtown and shopping malls.","Firearms must be checked in with Security Police.",,"33.90813, -117.27052",,"No Dining Hall on base",,"$14 discount when pre-pay for 14 days."
56,"Los Alamitos Legacy RV Park",33.79638,-118.05032,"https://www.militarycampgrounds.us/california/los-alamitos-army-campground","https://www.militarycampgrounds.us/media/reviews/photos/thumbnail/640x460s/ef/28/68/Los%20Alamitos%20CA%20001.jpg","[]","default",1,"{""title"":""California"",""url"":""california""}","no_access","{""user"":{""rating"":2.8889,""count"":9,""ratingClass"":""jrRatingsStyle1 jrRatingsGreen""}}","Los Alamitos Joint Forces Training Base, CA","33.79638, -118.05032","","From I-605, take the Katella Ave exit (about .75 miles North of the I-405 interchange), heading East. Go 1.5 miles to Lexington Drive and turn right (South) to the gate. Go straight after the gate after first speed bump turn left on Shiloh. Turn right on Yorktown Ave. to check in at Building #19 before occupying any RV site.","","(562) 795-2124","(562) 795-2125","Hospitality Services, 4745 Yorktown Ave, #19, Los Alamitos, CA 90720-5176",,"Active Duty, National Guard, Reservists, Retired Military, 0-100% DAV, Purple Heart Recipients, Former POW, Veteran Caregivers, DoD civilians. Read this article on Authorized Users","Year round.","Required. Must use credit card for deposit. 1 day charge if not canceled within 24 hrs of arrival date.","None available.","Must use local General Delivery.","No pets allowed.","","Restaurant and pub.","Dump, SewerWaterElectricPlaygroundPicinic AreaExchangeSwimming","","Stay policy is 30 days at a time may extend if space is available. Official duty/on orders may book a maximum of 90 days. After 90 days in RV park guest must have 30 days out before returning.","Allowed, but keep them in your vehicle.",,"33.799046, -118.054537","This email address is being protected from spambots. You need JavaScript enabled to view it.",,,
55,"Lemoore RV Park and Campground",36.26194,-119.89857,"https://www.militarycampgrounds.us/california/lemoore-naval-air-station-campground","https://www.militarycampgrounds.us/media/reviews/photos/thumbnail/640x460s/4b/f5/f4/NASL10.jpg","[]","default",1,"{""title"":""California"",""url"":""california""}","no_access","{""user"":{""rating"":3.4245,""count"":51,""ratingClass"":""jrRatingsStyle1 jrRatingsGreen""}}","Lemoore Naval Air Station, Lemoore, CA","36.261943, -119.898572","","Located on SR-198 between SR-99 & I-5, 6 mi. west of Lemoore. -- FROM SR-99, turn off onto SR-198 going West . Keep going through the town of Lemoore until you see the base on the right. The exit for the main gate from SR-198 is well marked. -- FROM I-5 coming from the north, take SR-198 East. Go about 20 miles to the main gate exit. -- FROM I-5 coming from the south, take SR-41 towards Fresno (NE). After about 21 miles, turn left (West) on Jackson Ave. (There's a sign for Lemoore NAS). Go about 3.3 miles, turn right, cross SR-198 and get onto SR-198 heading West. In about 1 mile, exit SR-198 to the main gate. -- ALL: Use the right lane of the main gate. Be VERY CAREFUL, as it's difficult to make the turns in a long RV. Many RV's will scrape or jump the right curb. Once through the main gate, continue straight to Franklin Ave. and turn right. When there's a McDonald's on the left, turn right onto Hancock Ave. The marked entrance to the campground is immediately on your left. You can pull in here and walk or drive to the ITT office for check-in. The ITT office is further down Hancock Ave, across the street from the RV Park and behind the gas station. If arriving after hours and on weekends, use the right lane of the main gate. If ITT is closed (although open 7 days a week), see the camp host. The self-checkin board at the campground entrance is no longer used and the instructions above it are outdated.","","(559) 998-0837/0838","(559) 997-7044","Tickets & Tours Building 920 NAS Lemoore, CA 93246",,"Active Duty, National Guard, Reservists, Retired Military, 0-100% DAV, Purple Heart Recipients, Former POW, Veteran Caregivers, DoD civilians, Sponsored Guests. Read this article on Authorized Users","Year round.","Accepted with a one night stay deposit required. Local Active Duty- 10 weeks in advance. Other active duty- 7 weeks in advance. All others- 5 weeks in advance. A credit card is required for a reservation.","Free WiFi and computers are available at the ITT office, located across the street behind the gas station.","(Your name), c/o Tickets and Tours, Building 920, NAS Lemoore, CA 93246","2 Pets are allowed but must adhere to base policies. Must provide current shot records. There is a large dog run at the RV Park.","","Propane, Hobby Shops, Driving Range, Cyber Center, Skate Park, Restaurant, Clubs, Dog Park.","Dump, SewerWaterElectricLaundryShowersPlaygroundGolfDieselGasCommissaryExchangeFitness CenterShoppeteSwimmingSnack BarClass VIMovie TheaterPharmacyHospital, ClinicPost OfficeCar Wash","","There is a 60 day stay limit, then out of the RV Park for a minimum of 7 days before returning.","Firearms not allowed.",,"36.26204,  -119.9144","This email address is being protected from spambots. You need JavaScript enabled to view it.",,"http://get.dodlodging.net/propertys/Lemoore-RV-Park",
51,"Fairways RV Resort",34.1732,-119.2067,"https://www.militarycampgrounds.us/california/fairways-rv-resort","https://www.militarycampgrounds.us/media/reviews/photos/thumbnail/640x460s/f3/ae/6f/Fairways004.jpg","[]","default",1,"{""title"":""California"",""url"":""california""}","no_access","{""user"":{""rating"":4.0667,""count"":69,""ratingClass"":""jrRatingsStyle1 jrRatingsGreen""}}","Port Hueneme Naval Construction Battalion Center, Port Hueneme, CA","34.1732, -119.2067","","From Pacific Coast Hwy, (Rt 1) exit to go west bound on Channel Islands Blvd.  About 6 tenths of a mile you have to make a left turn to go over Rice Blvd overpass.  Left on Ventura Road to go South. Travel about 3/4 mile to the Main gate on the right and just past the new Seabee Museum. Turn right onto 23rd Street to the gate (the street changes names from Sunkist to 23rd Street at this intersection, just to make things confusing). Once past the gate, continue straight ahead. Go thru 3 stop lights, the last one is Pacific Rd. Two blocks down, turn right on Salsa Road. If you get to the railroad tracks and the 4th stop light you've gone too far.  Go slow, 15 MPH speed limit.  RV park is at the end of the Salsa Road.","","(805) 982-6123","(805) 982-6123","MWR Fairways RV Resort, Bldg 1532, Salsa Ave, NBVC, Port Hueneme, CA",,"Active Duty, National Guard, Reservists, Retired Military, 0-100% DAV, Purple Heart Recipients, Former POW, Veteran Caregivers, DoD civilians, Sponsored Guests. Read this article on Authorized Users","Year round","Suggested. Active duty can make reservations 1 year in advance. Retired, DOD and all others may reserve 180 days in advance. Credit card required for reservation, but can pay cash or check at check-in. 30 days cancellation notice required. No shows are charged 1 night rent.","WiFi available in the RV Park.","FedEx and UPS: (Your Name and Site #), MWR Fairways RV Resort, Bldg 1534, Salsa Ave, NBVC, Port Hueneme, CA  ----  USPS: (Your name), c/o General Delivery, 560 East Pleasant Valley Rd., Port Hueneme, CA  93041 ","2 pets allowed with usual leash and clean-up rules. The following breeds are not allowed on base:  Chows, Doberman Pinschers, Presa Cantos, Pit Bulls (American Pit Bull Terrier), American Staffordshire Terrier/Bull Terrier, Rottweilerâ€™s and any Wolf Hybrid or any mix of the aforementioned breeds.  Pet leashes cannot exceed 10 feet.  ","","Propane","Dump, SewerWaterElectricLaundryShowersPlaygroundGolfDieselGasCommissaryExchangeFitness CenterShoppeteSnack BarClass VIMovie TheaterMuseumCar Wash","","Higher rates are for DOD and civilians. 30 day stay policy, then 14 days out before returning.",,,,,,,
50,"Palm Oasis RV Park and Resort",32.81768,-115.68015,"https://www.militarycampgrounds.us/california/el-centro-naf-campground","https://www.militarycampgrounds.us/media/reviews/photos/thumbnail/640x460s/fa/a0/75/NAF%20El%20Centro8.jpg","[]","default",1,"{""title"":""California"",""url"":""california""}","no_access","{""user"":{""rating"":4.0787,""count"":47,""ratingClass"":""jrRatingsStyle1 jrRatingsGreen""}}","El Centro Naval Air Facility, El Centro, CA","32.81768, -115.68015","","Eastbound on I-8: Exit at 107 to Seeley. Go left/north on S29 to Seeley. At stop sign, turn right/east on W. Evan Hewes Hwy/S80. At stop sign, turn left/north on Bennett Rd and proceed to the main gate. (See GATE below)  ----  Westbound on I-8 East: Exit at 111 and go right/north on Forrester Rd/S30. At traffic light turn left/west on West Evan Hewes Hwy. Turn right at second stop sign onto Bennett Rd and proceed to main gate.  (See GATE below)  ----  Eastbound on I-10/Palm Springs Area: Exit 145 to 86S/Westmorland/Brawley. At traffic light In Westmorland, turn right/south onto Forrester Rd. Proceed south approximately 20-miles to traffic light. Turn right/west on West Evan Hewes Hwy. Turn right at second stop sign onto Bennett Rd and proceed to main gate.   ----  GATE: At the main gate: use the truck/RV entrance on the right side. After the gate, proceed to the left side of the Blue Angle display. At the first intersection, turn left/west on D St. Go past the Palm Oasis RV Park sign and the RV Park and park on the right side after the bus stop/prior to the car wash. The office is located across the street at the north end of the building. You must have your vehicle registration with you at check-in. After hour check in with the Camp Host at site 85 â€“ across from the RV Lounge.","","(760) 339-2486",,"MWR, Bldg 318, Naval Air Facility, El Centro, CA 92243-5001 (Not for RV Park resident's personal mail)","http://navylifesw.com/elcentro/","Active Duty, National Guard, Reservists, Retired Military, 0-100% DAV, Purple Heart Recipients, Former POW, Veteran Caregivers, DoD civilians. Read this article on Authorized Users","Year round.","Accepted 1-year in advance for active duty and 6-months in advance for other authorized users. Call NAVY GATEWAY 1-877-NAVY BED (1-877-628-9233) and press #2 for Navy Getaways/RV reservations. ","Free Wi-Fi available in the RV Park.","No post office on base. No RV park personal US Mail delivery service on base. UPS & FedEx delivery to RV park. Post Office boxes and General Delivery available to Seeley (2-miles away) and El Centro (7-miles away).","The north part of the main RV park (sites 42-60) is a pet-free area: pets are not allowed in this area to include walking them on a leash. There is a limit of two (2) household pets per family/site. Pets must be leashed and under the direct control of an owner at all times. Loud barking will not be tolerated. Pet owners are responsible for picking up after their own pets. Ball field's #1 and #2 and the synthetic football field are pet-free areas. The fenced in dog park east of the RV Lounge and in the Palm Oasis Park South (located behind sites 100-106) are for RV park residents to exercise their animals. Dogs may be off leash in the two dog parks areas only. The following dog breeds, or any mix of, are not allowed: Chow, Doberman Pinscher, Presa, Canario, Pit Bull Terrier, American Stafford Terrier, Stafforshire Bull Terrier, Rottweiler, or any wolf hybrid.","","Water slide, Bowling, Club, Driving range, Go-cart track, Skate park, Auto shop, RV wash, Cyber cafe with WiFi.","Dump, SewerWaterElectricLaundryShowersPicinic AreaGasCommissaryExchangeFitness CenterShoppeteSwimmingClass VIMovie TheaterCar Wash","","Rates listed are for: Military-Guests. Check-in: 8:00am to 4:30pm. After hour check-in: See camp host. Check-out is at 11:00am. You must have your vehicle registration with you at check-in. The number of vehicles per site is limited to two (2) -- the RV and one other vehicle. No trailer or personal vehicles (such as: motorcycles, dune buggies, golf carts and other motorized vehicles) are allowed to be parked behind the RV. Car dollies can be stored under the RV in the rear. Contact the Auto Hobby Shop for storage space. 760.339.2689  ----  Hookups: Numerous sites require extra length sewer and water hoses. Come prepared with extra hoses.  RV Office does not provide these and they are not sold on base.",,,"32.8112,  -115.67228",,"Open to retirees and dependents for weekends and holidays with ID card. No civilian guest","http://get.dodlodging.net/propertys/Palm-Oasis-RV-Park",
