331,"Indian Island Recreation Area",48.04854,-122.74112,"https://www.militarycampgrounds.us/washington/windy-nook","https://www.militarycampgrounds.us/media/reviews/photos/thumbnail/640x460s/45/11/22/windy-nook-23-1447613818.png","[]","default",,"{""title"":""Washington"",""url"":""washington""}","no_access","{""user"":{""rating"":2.84,""count"":5,""ratingClass"":""jrRatingsStyle1 jrRatingsGreen""}}","Naval Undersea Warfare Center, Port Hadlock, WA","48.04854, -122.74112","","FROM OLYMPIA AND SOUTHWEST: Take Interstate 5 north to Olympia. Take Highway 101/12 toward Aberdeen/Shelton and then north on Highway 101 toward Shelton. Follow 101 north to Quilcene and take the Center Valley Rd. to the right. Follow to Chimacum. At the 4-way intersection with Beaver Valley Rd./SR 19, go straight. At the 4-way intersection in Port Hadlock, take a right on Flagler Rd. Once across the bridge onto Indian Island, stay to the left to the main gate. Ask gate guard for directions to Windy Nook.  ----  FROM SEQUIM AND PORT ANGELES: Take Highway 101 east, then a left onto State Route (SR) 20 east. Follow SR 20 to Anderson Lake Rd. and take a right. At Rhody Drive/SR 19 take a left. At Ness' Corner Rd. take a right. At the 4-way intersection with Irondale Rd. go straight and follow Flagler Rd. Once across the bridge onto Indian Island, stay to the left to the main gate. Ask gate guard for directions to Windy Nook.","","(360) 396-5343",,,,"CLOSED. Only active military stationed at Naval Undersea Warfare Center, Port Hadlock, WA are authorized to use this facility. Security was the reason stated.","Year round.","Reservations for the use of the facilities MUST be made no later then 10 working days in advance of the requested date of use. Reservations can be made by phone at (360) 396-5343, but must be followed up with a reservation form within 3 working days.","None",,"Pets must be controlled by their owners at all times. Pets are discouraged in recreation areas where other people are present. In developed areas, droppings must be cleaned up promptly.","","Ball Field, Tennis","ElectricTent AreaPicinic AreaBeachFishingBoat RampHikingExchangeFitness Center","","Cameras are authorized only at Crane Point and Parson's Park. MUST purchase an annual MWR Pass ($40). Security is very tight.","Firearms are strictly prohibited.",,,,,,
329,"Valdez Military Recreation Site",61.13333,-146.34716,"https://www.militarycampgrounds.us/alaska/valdez-military-recreation-site","https://www.militarycampgrounds.us/media/reviews/photos/thumbnail/640x460s/3b/6e/a2/SeaOtterRV_ValdezAK.jpg","[]","default",,"{""title"":""Alaska"",""url"":""alaska""}","no_access","{""user"":{""rating"":4.7,""count"":1,""ratingClass"":""jrRatingsStyle1 jrRatingsGreen""}}","Eielson AFB, AK","61.13333, -146.34716","","Take SR-4 to the city of Valdez. Turn right onto Pioneer Drive to Eagle's Rest RV campground on right. The check-in office for the Eielson Services trailers is on the right in a small building and not well-marked.","","Res/Info: (907) 377-1328/1232/1317 - Late Arrivals: (907) 835-4681",,"Valdez Military Recreation Site, c/o Eagle's Rest R.V. Park, 139 East Pioneer Drive, P.O. Box 610, Valdez, Alaska 99686","http://www.eielsonforcesupport.com/index.php?option=com_content&view=category&layout=blog&id=59&Itemid=133","Active Duty, National Guard, Reservists, Retired Military, 0-100% DAV, Purple Heart Recipients, Former POW, Veteran Caregivers, DoD civilians. Read this article on Authorized Users","Memorial Day - Labor Day","Accepted for trailers and boat rentals. Full payment required at time of reservation.",,,"Not allowed in the rental trailers.",,"No military facilities nearby. Town of Valdez has all normal services.","WaterElectricShowersPicinic AreaBeachFishingBoating, Boat RentalsHuntingHikingSwimmingMarina","","Eight rental trailers are available for rent to authorized military personnel. These trailers are located at the Eagle's Rest RV Park, a commercial RV Park. Eielson AFB Outdoor Recreation also has a small office located at the RV Park. The trailers have bathrooms and small kitchen areas, which include a stove, refrigerator, microwave and sink and kitchen packs (utensils, plates, pots, pans, etc.). The customer is responsible for providing their own bedding, linens, pillows, towels, etc. Linens are not available for check-out. Rates vary based on size of rental trailer.",,"
  The Department of Defense (DoD) Interactive Customer Evaluation (ICE) system is a web-based tool that collects feedback on services provided by various organizations throughout the Department of Defense (DoD). Click the ICE logo to submit your evaluation on this campground directly to the responsible department.",,,,,
326,"Camp Mabry Travel Camp",30.31863,-97.7582,"https://www.militarycampgrounds.us/texas/camp-mabry-travel-camp","https://www.militarycampgrounds.us/media/reviews/photos/thumbnail/640x460s/26/51/55/326_000_1269042200.jpg","[]","default",,"{""title"":""Texas"",""url"":""texas""}","no_access","{""user"":{""rating"":1.3,""count"":2,""ratingClass"":""jrRatingsStyle1 jrRatingsGreen""}}","Camp Mabry, TX","30.31863, -97.7582","",,"","(512) 782-5500",,"Camp Mabry, West 35th Street, Austin, Texas 78763-5218",,"National Guard on active duty only.","Year round.","Reservations required.",,,"Allowed with usual leash and clean-up rules.","",,"Dump, SewerWaterElectricExchange","","Small, busy RV park mainly used by Guard personnel on duty. Lower rates for active duty, higher rates for retired. Tight fit for RV's through the gate. 30 day stay limit.",,,"30.315787,  -97.764909 ",,,,
321,"Sherwood Point Cottage",44.89139,-87.4325,"https://www.militarycampgrounds.us/wisconsin/sherwood-point-cottage","https://www.militarycampgrounds.us/media/reviews/photos/thumbnail/640x460s/ae/3a/fe/sherwo8.jpg","[]","default",,"{""title"":""Wisconsin"",""url"":""wisconsin""}","no_access","{""user"":{""rating"":5,""count"":2,""ratingClass"":""jrRatingsStyle1 jrRatingsGreen""}}","Milwaukee Coast Guard Sector, WI","44.89139, -87.43250","","Proceed north on Hwy 42/57 and follow Coast Guard signs to the CG Station in Sturgeon Bay. From the Coast Guard Station proceed south on Hwy 42/57, then turn right onto County Road ""M"" and continue about 9 miles. Turn left onto Sherwood Road just before the log cabin tavern and proceed approximately 1/4 mile to the facility.","","(414) 747-7166",,"Coast Guard Station, 2501 Canal Road, Sturgeon Bay, WI",,"Active Duty, National Guard, Reservists, Retired Military, 0-100% DAV, Purple Heart Recipients, Former POW, Veteran Caregivers, DoD Civilians. Read this Article on Authorized Users","Year round.","Reservations are required at https://VacationRentalDesk.com.  Once a reservation is booked, you will receive a confirmation letter.  Please note, and adhere to, the payment deadline and all other policy in this letter.  Minimum stay is 2 nights; maximum stay is 7 nights. Cancellations are required 7 working days prior to check-in date to be considered for full refund.  If reservation cannot be used, it must be canceled; reservations are non-transferable.","None available.","Must use local USPS General Delivery.","Pets allowed with usual leash and clean-up rukes,",,,"Picinic AreaBeachFishingSnow SkiingHiking","","House has 2-bedrooms and is furnished with queen size bed, 4 twin size bunk beds, and a sleeper sofa. Unit comes with refrigerator, stove/oven, washer/dryer, DVD/VCR player, TV, and a microwave.  Dishes, glasses, cooking/eating utensils, pots/pans, toaster, coffee maker, pillows, and blankets are provided. Patrons must bring their own bed linens, all paper products, toiletries, towels, wash clothes, dish towels and food.  The house accommodates a maximum of 8 people. 2 night minimum stay with 7 day maximum stay limit. No smoking allowed. Cottage must be fuly cleaned prior to departure.",,,,"This email address is being protected from spambots. You need JavaScript enabled to view it.",,,
320,"Rawley Point Cottage",44.21328,-87.50875,"https://www.militarycampgrounds.us/wisconsin/rawley-point-cottage","https://www.militarycampgrounds.us/media/reviews/photos/thumbnail/640x460s/b3/63/07/rawley-point-cottage-1-1566643012.jpg","[]","default",,"{""title"":""Wisconsin"",""url"":""wisconsin""}","no_access","{""user"":{""rating"":3.65,""count"":2,""ratingClass"":""jrRatingsStyle1 jrRatingsGreen""}}","Milwaukee Coast Guard Sector, WI","44.21328, -87.50875","","Heading north on I-43, take exit 42/10 north. Proceed 7 miles and turn right on 17th Street. Cross over draw bridge and turn right on East Street for 4 blocks to CG Station Two Rivers to pick-up keys. From CG Station proceed on East Street to 22nd Street, turn right onto Hwy 42 for 4 blocks. Go straight onto County Road ""O."" Proceed 4 miles to Point Beach State Park entrance. If a Park Ranger is there, tell him you are going to the CG lighthouse. Proceed past gate and turn right into the lighthouse parking lot.","","(414) 747-7166",,"Coast Guard Station Two Rivers, 13 East Street, Two Rivers, WI","http://www.uscg.mil/mwr/Cottages/RawleyPointCottage.htm","Active Duty, National Guard, Reservists, Retired Military, 0-100% DAV, Purple Heart Recipients, Former POW, Veteran Caregivers, DoD Civilians. Read this Article on Authorized Users","Year round.","Reservations are required at https://VacationRentalDesk.com. Once a reservation is booked, you will receive a confirmation letter.  Minimum stay is 2 nights; maximum stay is 7 nights. Cancellations are required 7 working days prior to check-in date to obtain full refund. If reservation cannot be used, it must be canceled; reservations are non-transferable.","None available.","Must use local USPS General Delivery.","Pets are allowed with usual leash and clean-up rules.",,"Biking","Picinic AreaBeachFishingBoating, Boat RentalsSnow SkiingHunting","","The cottages are located within Point Beach State Forrest which offers 6 miles of Lake Michigan shoreline, with dunes, a lighthouse, camping, and hiking, biking, skiing, nature, and snowmobile trails.  The following link provides additional information on the State Forest.  http://www.dnr.state.wi.us/org/land/parks/specific/pointbeach  ----  Unit has a queen size bed, 4 twin size bunk beds, and a queen size sleeper sofa, microwave, refrigerator, washer/dryer, stove/oven, DVD/VCR player, and TV.  Dishes, glasses, cooking/eating utensils, pots/pans, toaster, coffee maker, pillows and blankets are provided.  Each unit can accommodate a maximum of 8 persons.  Failure to comply with the maximum occupancy rule will result in removal from the premises and forfeiture of rental fees.  Patrons should bring: Bed linens, towels, wash cloths, all paper products, toiletries, dish towels, and food. 2 night minimum stay and 7 night maximum stay limit. Cottage must be cleaned prior to departure.",,,,"This email address is being protected from spambots. You need JavaScript enabled to view it.",,,
319,"Sugar Grove Cottages",38.57344,-79.27384,"https://www.militarycampgrounds.us/west-virginia/sugar-grove-cottages","https://www.militarycampgrounds.us/media/reviews/photos/thumbnail/640x460s/86/c3/41/COA5D01-83-1384972047.jpg","[]","default",,"{""title"":""West Virginia"",""url"":""west-virginia""}","no_access","{""user"":{""rating"":5,""count"":3,""ratingClass"":""jrRatingsStyle1 jrRatingsGreen""}}","Sugar Grove Navy Information Operations Command, WV","38.57344, -79.27384 ","",,,,,,,,,,,,,,"Bowling, Equipment rentals.",,,,,,,,,,
318,"Cape Henry Inn and Cottages",36.92306,-76.04028,"https://www.militarycampgrounds.us/virginia/cape-henry-inn-and-cottages","https://www.militarycampgrounds.us/media/reviews/photos/thumbnail/640x460s/d8/96/e3/318_image1_1303777669.jpg","[]","default",,"{""title"":""Virginia"",""url"":""virginia""}","no_access","{""user"":{""rating"":3.925,""count"":2,""ratingClass"":""jrRatingsStyle1 jrRatingsGreen""}}","Fort Story, VA","36.92306, -76.04028","",,"",,,,,,,,,,,,,,,,,,,,,,
317,"Townsend Inlet Recreation Facility",39.12889,-74.70944,"https://www.militarycampgrounds.us/new-jersey/townsend-inlet-recreation-facility","https://www.militarycampgrounds.us/media/reviews/photos/thumbnail/640x460s/11/f4/10/townsend-inlet-recreation-facility-6-1582725882.png","[]","default",,"{""title"":""New Jersey"",""url"":""new-jersey""}","no_access","{""user"":{""rating"":0,""count"":0,""ratingClass"":""jrRatingsStyle1 jrRatingsGreen""}}","Atlantic City Coast Guard Air Station, NJ","39.12889, -74.70944","","FROM THE NORTH: Take the Garden State Expressway Exit 17. Travel east to Sea Isle City and follow to Landis Ave. Turn right on Landis and continue to 82nd street.  ----  FROM THE SOUTH: Take the Garden State Expressway Exit 13. Travel east to Avalon and follow to Ocean Drive. Go north along Ocean Drive, which changes to Landis Ave. The building is located on a full city block at the intersection of Landis Ave. and 82nd Street.","","(609) 263-3722",,"U.S. Coast Guard Townsend Inlet Recreation Facility, 8101 Landis Ave, Sea Isle City, NJ 08243, ATTN: Facility Attendant","http://www.uscg.mil/mwr/Cottages/TownsendInletRecreationFacility.htm","Active Duty, National Guard, Reservists, Retired Military, 0-100% DAV, Purple Heart Recipients, Former POW, Veteran Caregivers, DoD Civilians. Read this Article on Authorized Users","Year round.","Reservations are required.  All reservation requests may be submitted in writing or made by telephone between 8:00 AM and 4:00 PM, seven days a week. Reservations for active duty Coast Guard personnel and their dependents may be requested 90 days in advance.  Requests submitted before authorized reservation acceptance time will be returned to the originator.  Reservations for all other eligible patrons are considered using a priority system in accordance with the Morale, Well-Being, and Recreation Manual. Payments must be received by the 14th day after you make your reservation to be confirmed. Payment must be made by check or money order for the exact amount made payable to ""Townsend Inlet Recreational Fund."" Occupancy will be limited to 7 days, including 1 weekend.  Extensions of occupancy may be granted by the Recreation Quarters Attendant on a space available basis.  Reservations must be cancelled at least 14 days prior to occupancy or payment will be forfeited, and no refund will be made to the applicant.","None available.","Must use local USPS General Delivery.","Pets NOT allowed.",,"Bicycling","FishingSwimming","","4 apartments in a house that share a common kitchen, and dining room.  Apartments 3 and 4 share a common bathroom. Maximum occupancy of 6 people per apartment.  Cooking utensils, cutlery and small kitchen appliances are furnished. Bed linens, blankets, and towels are provided. Daily maid service is not provided. Cribs and rollaways are available on request.",,,,,,,
316,"Point Betsie Recreation Cottage",44.69028,-86.25417,"https://www.militarycampgrounds.us/michigan/point-betsie-recreation-cottage","https://www.militarycampgrounds.us/media/reviews/photos/thumbnail/640x460s/ab/c3/2d/pointb11.jpg","[]","default",,"{""title"":""Michigan"",""url"":""michigan""}","no_access","{""user"":{""rating"":4.625,""count"":2,""ratingClass"":""jrRatingsStyle1 jrRatingsGreen""}}","Grand Haven Coast Guard SFO, MI","44.69028, -86.25417","","FROM DETROIT, MI: Take I-75 to US 10, US 10 to Route 115 to Frankfort, MI. From Chicago, IL: I-94 to US 31, to Route 115 to Frankfort, MI. In Frankfort, follow the road signs to the US Coast Guard Station. After checking in, proceed north on Route 22 to Pt. Betsie Road. The cottage is 1/4 mile east of the lighthouse, Number 3526.","
","(616) 215-8022",,"Sector Field Office Grand Haven, 650 Harbor Drive, Grand Haven, MI 49417",,"Active Duty, National Guard, Reservists, Retired Military, 0-100% DAV, Purple Heart Recipients, Former POW, Veteran Caregivers, DoD Civilians. Read this Article on Authorized Users","Year round.","Reservations are required. Should be made as early as possible -- 120 days for active duty, 60 days for all other eligible patrons.",,,"Pets NOT allowed.",,,"BeachFishingBoating, Boat RentalsSnow SkiingHuntingGolfSwimming","","7 day maximum stay limit. The cottage is a 2-bedroom, 1-bath ranch house. A deck wraps around the south and west sides of the house providing great views of the lake. Sand dunes surround the cottage and access to Lake Michigan beach is only 200 yards from the back door. The cottage is nearby the historical Pt. Betsie lighthouse, on a road ending at Lake Michigan.",,,,,,"http://reservations.vacationrentaldesk.com/pika9qdlqr1.html",
314,"Cuttyhunk Island Recreation Housing Facility",41.41515,-70.93799,"https://www.militarycampgrounds.us/massachusetts/cuttyhunk-island-recreation-housing-facility","https://www.militarycampgrounds.us/media/reviews/photos/thumbnail/640x460s/d3/96/b9/cuttyhunk-island-recreation-housing-facility-99-1582648007.png","[]","default",,"{""title"":""Massachusetts"",""url"":""massachusetts""}","no_access","{""user"":{""rating"":0,""count"":0,""ratingClass"":""jrRatingsStyle1 jrRatingsGreen""}}","Boston Coast Guard Integrated Support Command, Cuttyhunk, MA","41.41515, -70.93799","","Take Exit 15: Route 18 South/Downtown. Turn left at the first light (left lane turn).  Turn right onto Macarthur Drive.  Turn left onto the State Pier.  You will see the Cuttyhunk Ferry, Co. ticket office on the right up the ramp next to the Ernestina.  Transportation to the island is via Cuttyhunk Ferry Co, Inc C-508-992-0200 (call for arrival/departure times www.cuttyhunkferryco.com ). Cuttyhunk Island is 15miles over water from New Bedford. Directions from ferry to house will be given at time reservations are made. Ferry reservations at least three weeks in advance are highly recommended. USMRA: page 17 (L-8). NMC: Boston, approximately 65 miles north. NMI: Newport Naval Station, RI, 35 miles southwest of New Bedford","","(617) 223-3181 â€“ answer system only.  Best contact is by email. ","(617) 223-3182","Commanding Officer (fm), USCG Integrated Support Command, ATTN: Morale Officer, 427 Commercial Street, Boston, MA 02109","http://www.uscg.mil/MWR/Cottages/CuttyhunkRecreationFacility.htm","Active Duty, National Guard, Reservists, Retired Military, 0-100% DAV, Purple Heart Recipients, Former POW, Veteran Caregivers, DoD Civilians. Read this Article on Authorized Users","Memorial Day weekend through Columbus Day weekend.","Reservations are required and will be considered on a prioritization system. Priority One: Active duty personnel and their dependents. Requests by email only are accepted beginning February 1 of the year. Priority Two: All other eligible patrons. Applications are accepted beginning April 1 of the year. A lottery is held 1 Apr for Priority 1 requestors and 15 Apr for Priority Tow requestors.  Up to 3 dates can be submitted for the lottery.  Once confirmed after the lottery, payment must be received within 10 days of the submission of the application. Once the check is received, the reservation is confirmed and an invoice will be emailed for confirmation of receipt of payment. Credit cards are not accepted. Recommend checking availability before faxing or mailing reservation requests. The rental period is usually from 10:00 AM on Sunday to 11:00 PM on the following Saturday (based on ferry schedule). However, other times or dates may be available. Priority is granted to week-long reservations.",,,"Pets are allowed.",,,"Picinic AreaBeachFishingBoating, Boat RentalsHikingSwimming","","Cuttyhunk Island is one of the Elizabeth Islands discovered in 1602 by Bartholomew Gosnold. The upstairs 3-bedroom apartment can sleep up to 10 people; the downstairs 2-bedroom apartment can sleep up to 5 people. Each apartment is provided with separate kitchen and bathroom facilities, is fully furnished, including bed linen, towels, and blankets. Baby pen and folding beds are available on the premises. Guests should bring their own food (very limited and expensive on the island).  Gas grills are provided, and propane can be purchased at the ferry terminal (bottle trade).  Camping out is not allowed. Rates vary based on rank and size of apartment.",,,,"This email address is being protected from spambots. You need JavaScript enabled to view it.",,,
312,"Coast Guard Temporary Quarters",41.66611,-70.61389,"https://www.militarycampgrounds.us/massachusetts/coast-guard-temporary-quarters","https://www.militarycampgrounds.us/media/reviews/photos/thumbnail/640x460s/dd/7e/e8/coast-guard-temporary-quarters-52-1582647841.png","[]","default",,"{""title"":""Massachusetts"",""url"":""massachusetts""}","no_access","{""user"":{""rating"":0,""count"":0,""ratingClass"":""jrRatingsStyle1 jrRatingsGreen""}}","Otis ANG Base/Cape Cod Coast Guard Air Station, MA ","41.66611, -70.61389","","From Bourne Bridge take Route 28 to the 2nd rotary and then the 3rd exit off rotary (Massachusetts Military Reservation) which leads to the main gate.  Take first right after gate (Hospital Road); stay to the right at fork and follow to stop sign.  At stop sign, cross over and continue on Hospital Road.  Take 1st right (Ent Street).  Building 5204 is 2nd building on left. ---- From Sagamore Bridge take Route 6 to 2nd exit (Route 130 exit).  Make right to Route 130 and travel approximately 4 miles to Snake Pond Road on the Reservation.  Make a right on Snake Pond Road and follow to gate.  Take a left after gate to the stop sign (Herbert Street); make a right at the stop sign and go to Shelton Road (1st left).  Take Shelton Road to rotary and exit on Connery Road.  Follow to stop sign and make left on Terpentine Street to stop sign.  Make right on Lee Road, take to 1st left (Hospital Road) and then to 1st right (Ent Street).  Building 5204 is 2nd one on left.","","(508) 968-6461",,"MWR Director, USCG Air Station Cape Cod, ATTN: Temporary Quarters Manager, Air Station Cape Cod, MA 02542-5024","http://www.uscg.mil/mwr/Cottages/CapeCodTemporaryQuarters.htm","Active Duty, National Guard, Reservists, Retired Military, 0-100% DAV, Purple Heart Recipients, Former POW, Veteran Caregivers, DoD Civilians. Read this Article on Authorized Users","Year round.","Required.  Active duty military personnel have priority.  PCS personnel: may request reservation 90 days in advance.  TAD personnel: may request reservation 30 days in advance.  Vacationers: October 16 through May 14 - 30 day advance reservation; May 15 through October 15 - 15 day advance reservation allowed.","None in rooms.",,"Pets NOT allowed.",,,"LaundryPlaygroundPicinic AreaGolfGasCommissaryExchangeFitness CenterShoppeteSwimmingMovie Theater","","2 week stay limit. No housekeeping in the townhouses. Rates vary based on rank and season.",,,,,,,
311,"Gull Cottage at Prospect Harbor",44.40335,-68.01298,"https://www.militarycampgrounds.us/maine/gull-cottage-at-prospect-harbor","https://www.militarycampgrounds.us/media/reviews/photos/thumbnail/640x460s/ed/16/63/Gull%20Cottage-sunset.jpg","[]","default",,"{""title"":""Maine"",""url"":""maine""}","no_access","{""user"":{""rating"":3.9625,""count"":4,""ratingClass"":""jrRatingsStyle1 jrRatingsGreen""}}","Portsmouth Naval Shipyard , Prospect Harbor, Maine","44.40335, -68.01298","","Take I-95 exit 182A onto I-395. Take exit 6A onto US-A-1 southeast through Ellsworth. Stay on US-1 into Gouldsboro and take a right onto ME-195 (The Pond Road) and follow it to the end which brings you into Prospect Harbor. Turn left onto ME-186 travel 0.1mi (cross bridge), then first right onto ME-195. Stay right onto Lighthouse Point Road.","","207-584-5099",,,"https://www.navymwrportsmouthshipyard.com/programs/3fe94bd4-72ac-40fc-a356-2ffed51be931","Active Duty, National Guard, Reservists, Retired Military, 0-100% DAV, Purple Heart Recipients, Former POW, Veteran Caregivers, DoD Civilians. Read this Article on Authorized Users","Year round.","Accepted up 6 months in advance for active duty and 3 months in advance for retired.",,,"Pets NOT allowed.",,,"Laundry","","Minimum stay is 2 nights, with maximum stay of 5 nights. Normal accommodations are for 6 people. Fully furnished linens towels, pots and pans. Washer and dryer in basement, cable TV, gas grill. Groups of 6 or more require approval.",,,,"This email address is being protected from spambots. You need JavaScript enabled to view it.",,,
310,"Pililaau Army Recreation Center",21.44669,-158.18969,"https://www.militarycampgrounds.us/hawaii/pililaau-army-recreation-center","https://www.militarycampgrounds.us/media/reviews/photos/thumbnail/640x460s/e2/d6/84/parc04.jpg","[]","default",,"{""title"":""Hawaii"",""url"":""hawaii""}","no_access","{""user"":{""rating"":3.66,""count"":5,""ratingClass"":""jrRatingsStyle1 jrRatingsGreen""}}","Fort Shafter, Oahu, HI","21.44669, -158.18969","",,"","(808) 696-6783  - Res: (808) 696-4158 ","(808) 696-7841","Pililaau Army Recreation Ctr, Bldg. 4070 85-010 Army Street, Waianae, Hawaii 96792","https://hawaii.armymwr.com/programs/pillar-army-recreation-center-parc","Active Duty, National Guard, Reservists, Retired Military, 0-100% DAV, Purple Heart Recipients, Former POW, Veteran Caregivers, DoD Civilians. Read this Article on Authorized Users","Year round.","Reservations can be made up to 365 days in advance by phone and are highly encouraged. U.S. Army active duty personnel and Army Reserve, Army National Guard Components, Family Members can reserve 365 days in advance. All others can reserve 90 days in advance.",,,,,"Restaurant and Bar, Kayaking, Snorkeling, Surfing, Equipment rental.","ShowersPicinic AreaBeachGolfSwimmingSnack Bar","","21 night stay limit. Rates vary based on rank and type of rental.",,,,"This email address is being protected from spambots. You need JavaScript enabled to view it.",,,
