159,"Smith Lake Army RV Park",35.13332,-78.922031,"https://www.militarycampgrounds.us/north-carolina/smith-lake-army-rv-park","https://www.militarycampgrounds.us/media/reviews/photos/thumbnail/640x460s/23/fe/92/Smith%20Lake%201.jpg","[]","default",,"{""title"":""North Carolina"",""url"":""north-carolina""}","no_access","{""user"":{""rating"":3.6341,""count"":63,""ratingClass"":""jrRatingsStyle1 jrRatingsGreen""}}","Fort Bragg, Fayetville, NC","35.14716, -78.92195","","Murchison Rd (Hwy 210) and Honeycutt Rd. Turn East onto Honeycutt for approx. 2 miles (passing Smith Army Airfield and Texas Lake). Turn right onto Smith Lake Rd approx. 1 mile to the RV Park office on the left.    ----  McArthur Rd and Honeycutt Rd. Turn West onto Honeycutt Rd approx. 1/2 mile. Turn left onto Smith Lake Rd. approx. 1 mile to the RV Park office on the left.   ----  From I-95 North or South, Take Exit 58 onto Bypass I-295 approx. 7 miles Turn right onto Ramsey Street (Hwy 401) approx. 1/4 mile Turn left onto Andrews Rd. approx 1 1/2 miles Turn left onto McArthur Rd approx 1/4 mile Turn right onto Honeycutt Rd approx. 1/2 mile Turn left onto Smith Lake Rd. approx.  ----  Check in office is Bldg. 5144 Smith Lake Road (at the Checkout/Rental Center Bldg.)","","(910) 396-5979/5984","(910) 907-2397","Bldg Q-2812 Smith Lake Rd, Fort Bragg, NC 28310","https://bragg.armymwr.com/programs/smith-lake-recreation-area","Active Duty, National Guard, Reservists, Retired Military, 0-100% DAV, Purple Heart Recipients, Former POW, Veteran Caregivers, DoD Civilians. Read this Article on Authorized Users","Year round.","Reservations accepted 90 days in advance.","None at the campground. Free WiFi at the Officers Club. Wifi (fee) available in the Exchange mall. For SPRINT PCS AIR CARD users, there is good reception and internet access","Must use local USPS General Delivery.","Allowed with the usual leash and clean-up rules.","",,"Dump, SewerWaterElectricTent AreaLaundryPlaygroundPicinic AreaBeachFishingBoating, Boat RentalsEquestrianCommissaryExchangeSwimmingMuseum","","Higher prices on FHU RV sites are for pull-through site. Pull-through RV sites have a 2 week stay limit. On other RV sites, there's a 60 day stay limit in the summer or 90 days stay limit in the winter. 2 day minimum stay on large cabins. Check in office is Bldg. 5144 Smith Lake Road (at the Checkout/Rental Center Bldg.)",,"
  The Department of Defense (DoD) Interactive Customer Evaluation (ICE) system is a web-based tool that collects feedback on services provided by various organizations throughout the Department of Defense (DoD). Click the ICE logo to submit your evaluation on this campground directly to the responsible department.",,,,,"$2 discount for America the Beautiful Card Holders"
158,"Seymour Johnson AFB FamCamp",35.36049,-77.96707,"https://www.militarycampgrounds.us/north-carolina/seymour-johnson-afb-famcamp","https://www.militarycampgrounds.us/media/reviews/photos/thumbnail/640x460s/28/22/ef/Seymour-Johnson%20AFB%2011-08-08%20007.jpg","[]","default",,"{""title"":""North Carolina"",""url"":""north-carolina""}","no_access","{""user"":{""rating"":3.4771,""count"":24,""ratingClass"":""jrRatingsStyle1 jrRatingsGreen""}}","Seymour Johnson AFB, Goldsboro, NC","35.36049, -77.96707","","From U.S. 70, East or West, take U.S. 117 South to Arrington Bridge Road turn left onto it. Go to Westbrook and turn left onto it. Go to Slocumb Street and turn right onto it. Slocumb Street will take you straight to the back gate. You must use the back gate for security purposes.. The nearest major city to the area is Raleigh, N.C.  ----  NOTE: After hours arrival - All transit will take place through the Berkeley gate. We ask that personnel call the ECC, 722-1212, giving us a minimum of 30 minutes notice they are going to be arriving to Berkeley Gate.","","(919) 722-1104",,"Outdoor Recreation, 34 SVS/SVRO, 1515 Goodson Street, Seymour Johnson AFB, NC 27531-5000","https://www.sjfss.com/outdoor-recreation/#1580836886513-68d08370-b1dd","Active Duty, National Guard, Reservists, Retired Military, 0-100% DAV, Purple Heart Recipients, Former POW, Veteran Caregivers, DoD Civilians. Read this Article on Authorized Users","Year round.","Not accepted.","None available. Good cell signal.","Must use local USPS General Delivery.","Allowed. You can walk them in the woods.","",,"Dump, SewerWaterElectricGolfGasCommissaryExchangeFitness CenterShoppeteSnack BarClass VIPost Office","","Be aware that the water hookup is on the patio side. You may need 20'+ of hose to reach the water spigot. The campground is four blocks from all activities. Limited sites available for 6-month stays, price is $1 a day higher. All other sites have a 14-day stay limit.","Not allowed on base.","
  The Department of Defense (DoD) Interactive Customer Evaluation (ICE) system is a web-based tool that collects feedback on services provided by various organizations throughout the Department of Defense (DoD). Click the ICE logo to submit your evaluation on this campground directly to the responsible department.",,,,,
157,"Onslow Beach Campsites and Recreation Area",34.57182,-77.26837,"https://www.militarycampgrounds.us/north-carolina/onslow-beach-campsites-and-recreation-area","https://www.militarycampgrounds.us/media/reviews/photos/thumbnail/640x460s/b9/9e/81/onslow-beach-campsites-and-recreation-area-45-1477073267.jpg","[]","default",,"{""title"":""North Carolina"",""url"":""north-carolina""}","no_access","{""user"":{""rating"":4.4742,""count"":87,""ratingClass"":""jrRatingsStyle1 jrRatingsGreen""}}","Camp Lejeune Marine Corps Base, NC","34.57182, -77.26837","","FROM SOUTH: Exit US-17 onto NC-172 and enter the base. At the third traffic light after entering the base (Brown sign for Onslow Beach Rec. Area) turn right and follow the road to the campground. After crossing a small bridge you will see the camp on your left. Turn left at end of the road. -- FROM NORTH: Take NC-24 to main gate on Holcomb Blvd. Stay on the main road. When the speed limit changes from 55mph to 45mph get in right turn lane to turn onto Sneeds Ferry Rd. Take this road about 6 miles to Beach Road (campground sign on the left). Beach road will take you right to the C/G area.","","Reservations: (910) 440-7502  ----  Guest Services: (910) 440-7259",,"RECR Onslow Beach, 1401 West Road, Camp Lejeune, NC 28547-7258","http://www.mccslejeune-newriver.com/beach/","Active Duty, National Guard, Reservists, Retired Military, 0-100% DAV, Purple Heart Recipients, Former POW, Veteran Caregivers, DoD Civilians. Read this Article on Authorized Users","April 1 - November 1","Accepted.  Active duty stationed on Camp Lejeune, MCAS New River and MCAS Cherry Point can reserve 20 weeks in advance.  Retired, Active Reservists and Active duty stationed at other bases(other that the ones previously mentioned) can reserve 18 weeks in advance.  Inactive reservists and DOD civilian employees can reserve 16 weeks in advance.  Payment in full is required 2 weeks from the booking date.  Full refund for cancellation will be given with at least  days notice before arrival, any cancellation less than 7 days notice will be charged 1 night rental fee and the rest will be refunded. May reserve 2 camp sites or 1 camp site and 1 lodging.","Free high speed wifi is available SDNCO and enlisted pavilions.","Must use local USPS General Delivery.","Pets are allowed in the RV Park and Campground and in the designated dog beach area (south of the Staff NCO Pavilion). There is a pet playground in the RV Park. Pets are allowed ONLY in pet friendly lodging. Pets are prohibited from the swimming beaches. You must present actual shot records from the vet or your stay may be denied. Usual clean up rules are strictly enforced everywhere in the rec area.  Pets must be on a leash (not more than 10 ft)at all times. Pets are not permitted inside any lodging unit.  Pets must not be left unattended in vehicles or tied up outside without supervision. Pets must be kept off neighboring campsites.","","Propane","Dump, SewerWaterElectricTent AreaGolfGasCommissaryExchange","","14 day stay limit, then out 14 days before starting over. No stay limit between Nov and Mar. Monthly rate only available from November 1st to March 31st. Lodges/Cabanas prices vary by rank and length of stay and sold in package deals. All RV sites are back-in and can be tight for some to back into. There are 2 handicap accessible 3-bedroom lodging available. During the peak season (from April 1 through October 31) you can only check into the lodging units (cabanas, lodges, Ospreys, etc.) on certain days. For a 3-day stay, one can only check in on a Monday or Tuesday; for a 4-day stay, one can only check in on a Thursday or Friday; and for a 7-day stay, one can only check in on a Monday, Tuesday, Thursday, or Friday. RV sites don't have these limitations.",,"
  The Department of Defense (DoD) Interactive Customer Evaluation (ICE) system is a web-based tool that collects feedback on services provided by various organizations throughout the Department of Defense (DoD). Click the ICE logo to submit your evaluation on this campground directly to the responsible department.","34.65495,  -77.23020",,,,"Monthly discount in Winter available."
155,"New River MCAS Marina",34.698743,-77.428324,"https://www.militarycampgrounds.us/north-carolina/new-river-mcas-marina","https://www.militarycampgrounds.us/media/reviews/photos/thumbnail/640x460s/93/26/f2/155_000_1269041694.jpg","[]","default",,"{""title"":""North Carolina"",""url"":""north-carolina""}","no_access","{""user"":{""rating"":0,""count"":0,""ratingClass"":""jrRatingsStyle1 jrRatingsGreen""}}","New River Marine Corps Air Station, Jacksonville, NC","34.64983, -77.4286","","Located in the SW section of Camp Lejune. Ask gate guard for directions to campground.","","(910) 449-6578",,"MWR, New River Marine Corps Air Station, Jacksonville, NC 28540-0128","http://www.newriver.usmc-mccs.org/semperfit.html","Active Duty, National Guard, Reservists, Retired Military, 0-100% DAV, Purple Heart Recipients, Former POW, Veteran Caregivers, DoD Civilians. Read this Article on Authorized Users","Year round.","Not accepted.","None available.","Must use local USPS General Delivery.","Allowed with the usual leash and cleanup rules.","",,"Tent Area","","Tent camping only.",,,,,,,
154,"Fort Fisher Air Force Recreation Area",33.98,-77.91,"https://www.militarycampgrounds.us/north-carolina/fort-fisher-air-force-recreation-area","https://www.militarycampgrounds.us/media/reviews/photos/thumbnail/640x460s/e7/39/17/mainsign.jpg","[]","default",,"{""title"":""North Carolina"",""url"":""north-carolina""}","no_access","{""user"":{""rating"":4.0085,""count"":88,""ratingClass"":""jrRatingsStyle1 jrRatingsGreen""}}","Seymour Johnson AFB, Kure Beach, NC","33.981303, -77.914415",,"Depending on where you are coming from is the key factor for traveling to Ft. Fisher. The initial goal is to reach Wilmington, NC by the route that suites your needs the best. Primary routes for getting to Wilmington NC are I-40 East ans US17 North or South. There are ample signs in Wilmington for Ft. Fisher and are easy to follow. They actually refer to the Fort Fisher State Park but the Ft. Fisher AF Recreation area is on the same route and about 2 miles up from the State Park. The route through Wilmington is straight through to Carolina Beach, then Kure Beach. Ft. Fisher is in the Kure Beach Community. Once inside Ft. Fisher continue straight in past the flag pole, around a slight curve and then you will see a directional sign pointing the way to the Reception Center. If you are coming from Myrtle Beach, SC you can take the ferry from Southport, SC. to Ft Fisher, NC.","","(910) 458-6549",,"Fort Fisher Outdoor Recreation Area, 118 Riverfront Road, Kure Beach, NC 28449-5000","https://www.sjfss.com/fort-fisher/","Active Duty, National Guard, Reservists, Retired Military, 0-100% DAV, Purple Heart Recipients, Former POW, Veteran Caregivers, DoD Civilians, and Guests. Read this Article on Authorized Users","Year round.","Reservations are accepted. 180 days in advance for SJAFB employees, 150 days n advance for other active duty, and 120 days on advance for all others.","WiFi available.","Must use local USPS General Delivery.","Allowed with usual leash and clean-up rules. Pets are not allowed to be walked on the beach.","",,"Dump, SewerWaterElectricTent AreaLaundryShowersPlaygroundBeachFishingBoating, Boat RentalsSwimmingMarina","","Sponsors must stay in campground with their guests for entire stay. Rates based on type of lodging and season. Some sites have 50A, but not all. Secondary sites vary in type of hook-up. ",,"
  The Department of Defense (DoD) Interactive Customer Evaluation (ICE) system is a web-based tool that collects feedback on services provided by various organizations throughout the Department of Defense (DoD). Click the ICE logo to submit your evaluation on this campground directly to the responsible department.
",,"This email address is being protected from spambots. You need JavaScript enabled to view it.",,,
153,"Elizabeth City Lodging",36.26966,-76.17933,"https://www.militarycampgrounds.us/north-carolina/elizabeth-city-lodging","https://www.militarycampgrounds.us/media/reviews/photos/thumbnail/640x460s/60/c3/67/Elizabeth_City_CGSC_-_Sites_1-4.jpg","[]","default",,"{""title"":""North Carolina"",""url"":""north-carolina""}","no_access","{""user"":{""rating"":4.1051,""count"":49,""ratingClass"":""jrRatingsStyle1 jrRatingsGreen""}}","Elizabeth City Coast Guard Support Center, NC","36.26966, -76.17933","","From US 17 in Elizabeth City, NC, take NC-344 (Halstead Blvd/Weeksville Rd.) south to the main gate of the CG Support Center. Portsmouth, VA is 50 miles to the north.","","(252) 335-6482 weekdays 0800-1600 ","(252) 335-6296","MWR Tickets and Reservations PSSU - Det. Elizabeth City/Hangar 7, 1664 Weeksville Road, Elizabeth City, NC, 27909",,"Active Duty, National Guard, Reservists, Retired Military, 0-100% DAV, Purple Heart Recipients, Former POW, Veteran Caregivers, DoD/DOT/NASA Civilians. Read this Article on Authorized Users","Year round.","Required accepted up to 90 days in advance (very busy April-September). For reservation or other information, contact:  Phone: (252) 335-6482  --  Fax: (252) 335-6296 (Mon-Fri, 0730-1530hr)","None available.","Must use local USPS General Delivery.","Pets allowed at RV sites but not allowed in rental cabins or mobile homes.","",,"Dump, SewerWaterElectricLaundryShowersPlaygroundPicinic AreaFishingBoating, Boat RentalsHikingGasExchangeFitness CenterShoppeteSwimming","","Maximum stay is 30 days in RV, Cabin or Trailer (can be extended with permission from the CO). RV Park showers are closed October - April.",,,,"This email address is being protected from spambots. You need JavaScript enabled to view it.","Retired military are allowed to utilize the dining facilities.",,
151,"Round Pond Recreation Area",41.3777,-74.0267,"https://www.militarycampgrounds.us/new-york/round-pond-recreation-area","https://www.militarycampgrounds.us/media/reviews/photos/thumbnail/640x460s/92/6c/db/6-Swim%20area.jpg","[]","default",,"{""title"":""New York"",""url"":""new-york""}","no_access","{""user"":{""rating"":4.0326,""count"":49,""ratingClass"":""jrRatingsStyle1 jrRatingsGreen""}}","U.S. Military Academy, West Point, NY","41.3777, -74.0267","","Take exit 16 from I-87. Go North on US-6 for about 2.5 miles. Turn North on SR-293 and go another 5.5 miles. Turn left on Round Pond Rd. to campground.  ----  Address for GPS is: 1348 Round Pond Road, West Point, NY 10996  ----  Steep grade to get to the campground. You may wish to unhook your ""toad"" first.","","(845) 938-2503",,"IMNE-MIL-MWR, Round Pond Recreation Area, BLDG 681, Hardee Place, 2nd Floor, West Point, New York 10996","https://westpoint.armymwr.com/programs/round-pond-recreation-area","Active Duty, National Guard, Reservists, Retired Military, 0-100% DAV, Purple Heart Recipients, Former POW, Veteran Caregivers, DoD Civilians, Cadets and Parents. Read this Article on Authorized Users","Apr 1 - Oct 30.","Active Duty may make reservations starting the day after Martin Luther King Jr. holiday.  All other categories may make reservation the day after President's Day.  ","Internet access is available on base. Marginal Verizon broadband, but strong with amplifier and external antenna. Low AT&T cell signal with no data service.","Must use local USPS General Delivery.","Allowed with the usual leash and cleanup rules.","","Volleyball courts, Basketball court, Bait & Tackle store, Outdoor Equipment Rental Center.","Dump, SewerWaterElectricTent AreaLaundryShowersPlaygroundPicinic AreaBeachFishingBoating, Boat RentalsHikingSwimming","","Dump station available. Higher rates are for holidays and Army football weekends. Honey Wagon service is available Mon and Fri, $8. Dump available. The Round Pond Recreation area is located in a rocky, woody area, just three miles from the United States Military Academy. Round Pond is a clear mountaintop lake surrounded by a beach, playgrounds, picnic areas and campsites. The lake has lifeguards on duty at the swimming beach during the summer months. The Outdoor Equipment Resource Center, located behind the Round Pond Office and Bait Shop, has camping equipment, boats & trailers, party canopies and various sports equipment for rent. West Point fishing passes, as well as power boat passes for Stillwell and Popolopen Lake, are available at the Round Pond Office. The office also serves as the fishing boat control point.",,,,,,,
150,"Remington Park RV Campground",44.05727,-75.76552,"https://www.militarycampgrounds.us/new-york/fort-drum-recreation-area","https://www.militarycampgrounds.us/media/reviews/photos/thumbnail/640x460s/ce/4e/5d/fort-drum-recreation-area-31-1586692024.jpg","[]","default",,"{""title"":""New York"",""url"":""new-york""}","no_access","{""user"":{""rating"":3.7257,""count"":35,""ratingClass"":""jrRatingsStyle1 jrRatingsGreen""}}","Fort Drum, Watertown, NY","44.057274, -75.765518",,"Take Hwy 26 (Troop convey road) and come in the Gasoline Alley/Oneida St gate. Go to 1st traffic light/Tigris River Valley Rd and turn R. Then turn R on Remington Park Rd which is before the traffic light. Take 2nd entrance into the park. Office is on the left and is unmarked.","","(315) 774-7331",,"Billeting Office, PO Box 204, Fort Drum, NY 13602-0204","https://drum.armymwr.com/programs/remington-park-rv-campground","Active Duty, National Guard, Reservists, Retired Military, 0-100% DAV, Purple Heart Recipients, Former POW, Veteran Caregivers, DoD Civilians. Read this Article on Authorized Users","1 April - 31 October for RV Park, Adirondacks and tent sites. Cabins are available year round.","Highly recommended.","Verizon WiFi 4G Jetpack&#039;s are available to rent. $15 a day, $25 a week and $40 for a month.","Must use local USPS General Delivery.","Allowed with the usual leash and clean-up rules. There is a $5 daily pet cleaning fee for the cabins only. (Not to exceed $75 for long term stays).","",,"Dump, SewerWaterElectricTent AreaLaundryShowersPicinic AreaCommissaryExchange","","Cabin rates based on location. Higher rates include WiFi. Remington Park has 25 fully furnished 1 and 2 bedroom cabins with a loft and sleeper sofa to accommodate a maximum of 6 people. Cabins have TV, microwave, coffee pot, toaster, 2 burner stove with full sink and refrigerator in the kitchenette. There is a double bed in the master bedroom and 1 twin bed in the second bedroom and 3 twin beds in the loft. Some dishes, coffee cups, glasses, silverware, and pots and pans are provided. You must bring your own pillows and bed linens. All cabins and campsites are located within beautiful Remington Park. The Park consists of a Lake with beach, 2 large childrenâ€™s playgrounds, dog park, fishing, picnic pavilions, and gazebos, a rental office for fishing gear, boats, and sports equipment is available next to the beach. There are miles of hiking and biking trails. Bikes and golf carts are also available for rent. The Campground office is newly renovated and located within Remington Park at Building number 11430 Pech River Road, Fort Drum, NY 13602.",,"
  The Department of Defense (DoD) Interactive Customer Evaluation (ICE) system is a web-based tool that collects feedback on services provided by various organizations throughout the Department of Defense (DoD). Click the ICE logo to submit your evaluation on this campground directly to the responsible department.","44.05405, -75.83342","This email address is being protected from spambots. You need JavaScript enabled to view it.",,,
146,"NJ National Guard Training Center RV Sites",40.12827,-74.04232,"https://www.militarycampgrounds.us/new-jersey/nj-national-guard-training-center-rv-sites","https://www.militarycampgrounds.us/media/reviews/photos/thumbnail/640x460s/19/cd/7c/seagirt2004-1.jpg","[]","default",,"{""title"":""New Jersey"",""url"":""new-jersey""}","no_access","{""user"":{""rating"":3.9625,""count"":8,""ratingClass"":""jrRatingsStyle1 jrRatingsGreen""}}","New Jersey Training Center, Sea Girt, NJ","40.12827, -74.04232","","FROM THE WEST: Take I-195 East. I-195 turns into 138E. Take Rt 35 South SEA GIRT exit. Stay on Rt 35 South for approximately 2.5 miles. Make left onto Sea Girt Avenue. Continue on Sea Girt Ave for approx 1.5 miles to intersection of Rt 71. Cross over Rt 71 - proceed approx 50 yds and bear right after crossing railroad tracks. Make right turn into National Guard Training Center. --- FROM NJ TURNPIKE (North or South): Take exit 7A - Follow exit to I-195 East. Follow above directions. --- FROM GARDEN STATE PKWY`(North or South): Exit 98 off GSP - Route 138 East. Follow above directions. --- NOTE: Please be prepared with a photo ID and/or driver's license to show the gate guard.","","(732) 974-5951",,,,"Active Duty, National Guard, Reservists, Retired Military, 0-100% DAV, Purple Heart Recipients, Former POW, Veteran Caregivers, DoD Civilians. Read this Article on Authorized Users","Year round. Water shut-off during the winter.","Accepted beginning the first Wednesday of April. Reservations are only accepted on Wednesdays from 0900 - 1200hrs. Payment in full via credit card is required upon making a reservation. ","None.","Must use local USPS General Delivery.","Pets NOT allowed.","","Crabbing Dock.","Dump, SewerWaterElectricShowersPlaygroundBeachFishingMuseum","","Rates vary based on season, size of RV and if on official travel. Highest rates are for summer, RV over 20' in length, and not on official travel. Summer season is May 23, 2020 through September 26, 2020. Off season is September 26, 2020 through May 29, 2021. During the off season, the water is shut off at the RV sites, and the bath house is closed. Only self-contained RV's allowed in the off season.",,,,,,,
145,"Lake Laurie Campground",39.0269,-74.8908,"https://www.militarycampgrounds.us/new-jersey/lake-laurie-campground","https://www.militarycampgrounds.us/media/reviews/photos/thumbnail/640x460s/63/84/54/lake-laurie-campground-48-1535820086.jpg","[]","default",,"{""title"":""New Jersey"",""url"":""new-jersey""}","no_access","{""user"":{""rating"":0,""count"":0,""ratingClass"":""jrRatingsStyle1 jrRatingsGreen""}}","Willow Grove Naval Air Station, NJ","39.0269, -74.8908",,,,,,,,,,,,,,,"Laundry",,,,,,,,,,
144,"Lake Denmark Recreation Area",40.9654,-74.5257,"https://www.militarycampgrounds.us/new-jersey/lake-denmark-recreation-area","https://www.militarycampgrounds.us/media/reviews/photos/thumbnail/640x460s/b6/6a/a1/lake-denmark-recreation-area-36-1535819989.jpg","[]","default",,"{""title"":""New Jersey"",""url"":""new-jersey""}","no_access","{""user"":{""rating"":3.85,""count"":1,""ratingClass"":""jrRatingsStyle1 jrRatingsGreen""}}","Picatinny Aresenal, NJ","40.9654, -74.5257",,,,,,,,,,,,,,,,,,,,,,,,,
